{
 "chunks": [
  {
   "chars": 542,
   "doc_path": [
    "Security and Compliance"
   ],
   "elements": [
    1,
    2
   ],
   "kb_id": "kb_f3b23332d1"
  },
  {
   "chars": 481,
   "doc_path": [
    "Reporting and Analytics"
   ],
   "elements": [
    3,
    4
   ],
   "kb_id": "kb_eb08909f36"
  }
 ],
 "doc_id": "cd_2964d579a7ae",
 "elements": [
  {
   "kind": "heading",
   "level": 2,
   "text": "Security and Compliance"
  },
  {
   "kind": "paragraph",
   "text": "[CLIENT]'s regulatory posture required SOC 2 Type II\nalignment and state insurance-department audit readiness from day one. We\nimplemented role-based access with segregation-of-duties rules enforced at\nthe workflow level: no user could both create and approve a payment run,\nand quarterly access recertification was automated with line-manager\nattestation. All environment access ran through the client's identity\nprovider; no local accounts existed in any tier. Audit logging streamed to\n[CLIENT]'s SIEM with a documented retention schedule."
  },
  {
   "kind": "heading",
   "level": 2,
   "text": "Reporting and Analytics"
  },
  {
   "kind": "paragraph",
   "text": "We rebuilt the month-end close reporting stack on the platform's embedded\nanalytics rather than the legacy data warehouse, cutting close-cycle\nreporting from nine days to four. Finance power users received a governed\nsemantic layer \u2014 conformed dimensions for entity, department, and program \u2014\nso ad hoc analysis no longer required IT tickets. The reporting workstream\nwas delivered within the [FEE] engagement fee. Reference contact:\n[REFERENCE_NAME], VP of Finance Transformation."
  }
 ],
 "extraction_fingerprint": "ext_38ba495d55b7b40c",
 "extraction_status": "clean",
 "extractor": "text",
 "media": {
  "images": 0
 },
 "source_hash": "2964d579a7ae2fa368326d1d8673f79664a0c3ab541f19d0f5c5d859a2f2cfd4"
}
